[
  {
    "candidate_id": "cn-extra-huorong-2023-public-behavior",
    "candidate_source_url": "https://www.huorong.cn/document/tech/vir_report/888.html",
    "candidate_source_title": "“云即玩”模拟器捆绑流氓软件，用户需提高警惕",
    "candidate_source_date": "2023-12-04",
    "candidate_source_name": "火绒安全公开技术文章",
    "source_type": "public_vendor_behavior_article",
    "claimed_software_name": "公开文章所述 Windows 捆绑推广行为（待人工拆分）",
    "claimed_publisher": "未认定；不得映射厂商全部产品",
    "claimed_aliases": [],
    "raw_claim_summary": "文章公开描述特定下载链路中的捆绑、静默安装、推广和持久化行为；这里只保存行为摘要，不复制检测规则。",
    "proposed_behavior_categories": ["forced_installation", "malicious_bundling", "ad_popup"],
    "proposed_mapping_type": "analogical_behavior",
    "proposed_entity_scope": "windows_desktop_software",
    "proposed_relation_confidence": "low",
    "proposed_analogy_basis": "公开行为可帮助复核类似现象，但不能确认当前本机软件、同名实体或所有版本。",
    "proposed_confidence": 0.45,
    "proposed_false_positive_risk": "high",
    "proposed_evidence_scope": "review",
    "jurisdiction": "CN",
    "language": "zh-CN",
    "license_note": "公开网页引用元数据和克制摘要；不复制检测材料。",
    "submitted_by": "PC CleanGuard maintainers",
    "review_notes": "必须取得独立第二来源和本机身份/版本证据；当前不得 approved。",
    "created_at": "2026-07-13"
  },
  {
    "candidate_id": "cn-extra-xinhua-2021-pc-popup",
    "candidate_source_url": "https://www.news.cn/politics/2021-10/29/c_1128011080.htm",
    "candidate_source_title": "工信部召开规范电脑PC端应用软件弹窗信息骚扰用户问题行政指导会",
    "candidate_source_date": "2021-10-29",
    "candidate_source_name": "新华网",
    "source_type": "public_news_or_public_report",
    "claimed_software_name": "PC 端弹窗、难关闭与强制捆绑行为（来源级候选）",
    "claimed_publisher": "未认定；参会不等于违规",
    "claimed_aliases": [],
    "raw_claim_summary": "公开报道描述 PC 端弹窗、自启动、难关闭和强制捆绑等治理背景；不形成企业或产品 verdict。",
    "proposed_behavior_categories": ["forced_installation", "ad_popup", "malicious_bundling", "other_user_rights_violation"],
    "proposed_mapping_type": "analogical_behavior",
    "proposed_entity_scope": "windows_desktop_software",
    "proposed_relation_confidence": "low",
    "proposed_analogy_basis": "一般行为描述可用于解释和人工复核，不能识别本机实体。",
    "proposed_confidence": 0.4,
    "proposed_false_positive_risk": "high",
    "proposed_evidence_scope": "explanation",
    "jurisdiction": "CN",
    "language": "zh-CN",
    "license_note": "公开新闻元数据和简要概括。",
    "submitted_by": "PC CleanGuard maintainers",
    "review_notes": "需要官方原始材料、具体产品/版本和本机证据交叉核验。",
    "created_at": "2026-07-13"
  }
]
