[
  {
    "candidate_id": "candidate-ms-installcore",
    "candidate_source_url": "https://www.microsoft.com/en-us/wdsi/threats/malware-encyclopedia-description?Name=PUA%3AWin32%2FInstallCore",
    "candidate_source_title": "PUA:Win32/InstallCore threat description - Microsoft Security Intelligence",
    "candidate_source_date": "2015-03-11",
    "candidate_source_name": "Microsoft Security Intelligence",
    "source_type": "public_vendor_behavior_article",
    "claimed_software_name": "PUA:Win32/InstallCore",
    "claimed_publisher": "Unknown (Microsoft detection family)",
    "claimed_aliases": [],
    "raw_claim_summary": "Microsoft 页面描述该 Windows PUA 家族可能捆绑非预期软件、修改浏览器设置与快捷方式，并安装浏览器扩展；本记录仅复述页面中的行为范围。",
    "proposed_behavior_categories": ["forced_installation", "browser_hijacking", "malicious_bundling"],
    "proposed_mapping_type": "direct_entity",
    "proposed_entity_scope": "windows_desktop_software",
    "proposed_relation_confidence": "high",
    "proposed_analogy_basis": null,
    "proposed_confidence": 0.8,
    "proposed_false_positive_risk": "medium",
    "proposed_evidence_scope": "review",
    "jurisdiction": "global",
    "language": "en-US",
    "license_note": "Public Microsoft page; store citation metadata and a short Chinese paraphrase only.",
    "submitted_by": "PC CleanGuard maintainers",
    "review_notes": "页面明确给出 Windows detection family、发布日期和可观察行为；不外推到同名普通软件。",
    "created_at": "2026-07-13"
  },
  {
    "candidate_id": "candidate-ms-fusioncore",
    "candidate_source_url": "https://www.microsoft.com/en-us/wdsi/threats/malware-encyclopedia-description?Name=PUA%3AWin32%2FFusionCore",
    "candidate_source_title": "PUA:Win32/FusionCore threat description - Microsoft Security Intelligence",
    "candidate_source_date": "2016-06-28",
    "candidate_source_name": "Microsoft Security Intelligence",
    "source_type": "public_vendor_behavior_article",
    "claimed_software_name": "PUA:Win32/FusionCore",
    "claimed_publisher": "Unknown (Microsoft detection family)",
    "claimed_aliases": [],
    "raw_claim_summary": "Microsoft 页面将该 Windows PUA 家族描述为 bundling software，并说明其可能安装其他潜在不需要的应用；本记录不推断具体安装实例。",
    "proposed_behavior_categories": ["malicious_bundling"],
    "proposed_mapping_type": "direct_entity",
    "proposed_entity_scope": "windows_desktop_software",
    "proposed_relation_confidence": "high",
    "proposed_analogy_basis": null,
    "proposed_confidence": 0.75,
    "proposed_false_positive_risk": "medium",
    "proposed_evidence_scope": "review",
    "jurisdiction": "global",
    "language": "en-US",
    "license_note": "Public Microsoft page; store citation metadata and a short Chinese paraphrase only.",
    "submitted_by": "PC CleanGuard maintainers",
    "review_notes": "页面给出发布日期和明确的 Windows bundler 行为描述。",
    "created_at": "2026-07-13"
  },
  {
    "candidate_id": "candidate-ms-slimware",
    "candidate_source_url": "https://www.microsoft.com/en-us/wdsi/threats/malware-encyclopedia-description?Name=PUA%3AWin32%2FSlimware",
    "candidate_source_title": "PUA:Win32/Slimware threat description - Microsoft Security Intelligence",
    "candidate_source_date": "2017-02-08",
    "candidate_source_name": "Microsoft Security Intelligence",
    "source_type": "public_vendor_behavior_article",
    "claimed_software_name": "PUA:Win32/Slimware",
    "claimed_publisher": "Unknown (Microsoft detection family)",
    "claimed_aliases": [],
    "raw_claim_summary": "Microsoft 页面描述该 Windows PUA 家族展示可疑问题并要求付费修复、在应用外显示广告，并可能捆绑安装其他应用。",
    "proposed_behavior_categories": ["ad_popup", "malicious_bundling", "other_user_rights_violation"],
    "proposed_mapping_type": "direct_entity",
    "proposed_entity_scope": "windows_desktop_software",
    "proposed_relation_confidence": "high",
    "proposed_analogy_basis": null,
    "proposed_confidence": 0.78,
    "proposed_false_positive_risk": "medium",
    "proposed_evidence_scope": "review",
    "jurisdiction": "global",
    "language": "en-US",
    "license_note": "Public Microsoft page; store citation metadata and a short Chinese paraphrase only.",
    "submitted_by": "PC CleanGuard maintainers",
    "review_notes": "实体名称限定为页面 detection family；别名命中仍需核对发布者和本地证据。",
    "created_at": "2026-07-13"
  },
  {
    "candidate_id": "candidate-ms-piriformbundler",
    "candidate_source_url": "https://www.microsoft.com/en-us/wdsi/threats/malware-encyclopedia-description?Name=PUA%3AWin32%2FPiriformBundler",
    "candidate_source_title": "PUA:Win32/PiriformBundler threat description - Microsoft Security Intelligence",
    "candidate_source_date": "2020-07-27",
    "candidate_source_name": "Microsoft Security Intelligence",
    "source_type": "public_vendor_behavior_article",
    "claimed_software_name": "PUA:Win32/PiriformBundler",
    "claimed_publisher": "Piriform",
    "claimed_aliases": [],
    "raw_claim_summary": "Microsoft 页面仅针对被识别为该 PUA detection family 的特定安装器，描述其捆绑其他提供方软件的行为；不把 Piriform 产品整体标记为 PUA。",
    "proposed_behavior_categories": ["malicious_bundling"],
    "proposed_mapping_type": "direct_entity",
    "proposed_entity_scope": "windows_desktop_software",
    "proposed_relation_confidence": "medium",
    "proposed_analogy_basis": null,
    "proposed_confidence": 0.7,
    "proposed_false_positive_risk": "high",
    "proposed_evidence_scope": "explanation",
    "jurisdiction": "global",
    "language": "en-US",
    "license_note": "Public Microsoft page; store citation metadata and a short Chinese paraphrase only.",
    "submitted_by": "PC CleanGuard maintainers",
    "review_notes": "必须保留‘特定安装器’限定，不能将产品名或发布者整体映射为执行建议。",
    "created_at": "2026-07-13"
  },
  {
    "candidate_id": "candidate-ms-mediaarena",
    "candidate_source_url": "https://www.microsoft.com/en-us/wdsi/threats/malware-encyclopedia-description?Name=PUA%3AWin32%2FMediaArena&threatId=359463",
    "candidate_source_title": "PUA:Win32/MediaArena threat description - Microsoft Security Intelligence",
    "candidate_source_date": "2023-03-20",
    "candidate_source_name": "Microsoft Security Intelligence",
    "source_type": "public_vendor_behavior_article",
    "claimed_software_name": "PUA:Win32/MediaArena",
    "claimed_publisher": "Unknown (Microsoft detection family)",
    "claimed_aliases": [],
    "raw_claim_summary": "Microsoft 页面描述该 Windows PUA 家族可能修改浏览器设置、重定向搜索并收集搜索查询；记录不声称同名普通文件必然属于该家族。",
    "proposed_behavior_categories": ["browser_hijacking", "malicious_collection"],
    "proposed_mapping_type": "direct_entity",
    "proposed_entity_scope": "windows_desktop_software",
    "proposed_relation_confidence": "high",
    "proposed_analogy_basis": null,
    "proposed_confidence": 0.8,
    "proposed_false_positive_risk": "medium",
    "proposed_evidence_scope": "review",
    "jurisdiction": "global",
    "language": "en-US",
    "license_note": "Public Microsoft page; store citation metadata and a short Chinese paraphrase only.",
    "submitted_by": "PC CleanGuard maintainers",
    "review_notes": "页面提供 Windows detection family、发布日期与具体浏览器行为描述。",
    "created_at": "2026-07-13"
  }
]
